{
  "$schema": "https://json-schema.org/draft/2020-12/schema",
  "$id": "urn:srcos:agent-machine:schema:a2a-state-machine:v0.1.0",
  "title": "A2AStateMachine",
  "description": "Secret-free Agent-to-Agent control-plane lifecycle contract for attested capability negotiation, scoped MCP binding, execution, revocation, and settlement.",
  "type": "object",
  "additionalProperties": false,
  "required": ["specVersion", "id", "kind", "participants", "planes", "phases", "revocation", "receiptSafety", "issuedAt"],
  "properties": {
    "specVersion": {"type": "string", "const": "0.1.0"},
    "id": {"type": "string", "pattern": "^urn:srcos:agent-machine:a2a-state-machine:[a-z0-9][a-z0-9-]*$"},
    "kind": {"type": "string", "const": "A2AStateMachine"},
    "participants": {
      "type": "object",
      "additionalProperties": false,
      "required": ["initiatorAgentRef", "responderAgentRef", "hostRefs"],
      "properties": {
        "initiatorAgentRef": {"type": "string"},
        "responderAgentRef": {"type": "string"},
        "hostRefs": {"type": "array", "minItems": 1, "items": {"type": "string"}, "uniqueItems": true}
      }
    },
    "planes": {
      "type": "object",
      "additionalProperties": false,
      "required": ["controlPlane", "toolPlane", "controlToolSeparationRequired"],
      "properties": {
        "controlPlane": {"type": "string", "const": "a2a"},
        "toolPlane": {"type": "string", "const": "mcp"},
        "controlToolSeparationRequired": {"type": "boolean", "const": true}
      }
    },
    "phases": {
      "type": "array",
      "minItems": 9,
      "maxItems": 9,
      "prefixItems": [
        {"const": "HELLO"},
        {"const": "ATTEST"},
        {"const": "DISCOVER"},
        {"const": "NEGOTIATE"},
        {"const": "UX_CONTRACT"},
        {"const": "GRANT"},
        {"const": "BIND"},
        {"const": "EXECUTE"},
        {"const": "AUDIT_SETTLE"}
      ],
      "items": false
    },
    "revocation": {
      "type": "object",
      "additionalProperties": false,
      "required": ["revocationRequired", "revocationBeatsKill", "propagationTargetSeconds", "revocationEventRef"],
      "properties": {
        "revocationRequired": {"type": "boolean", "const": true},
        "revocationBeatsKill": {"type": "boolean", "const": true},
        "propagationTargetSeconds": {"type": "integer", "minimum": 0},
        "revocationEventRef": {"type": ["string", "null"]}
      }
    },
    "receiptSafety": {"$ref": "#/$defs/receiptSafety"},
    "issuedAt": {"type": "string"},
    "labels": {"type": "object", "additionalProperties": {"type": "string"}}
  },
  "$defs": {
    "receiptSafety": {
      "type": "object",
      "additionalProperties": false,
      "required": ["includeRawContent", "secretValuesIncluded", "privateMemoryIncluded"],
      "properties": {
        "includeRawContent": {"type": "boolean", "const": false},
        "secretValuesIncluded": {"type": "boolean", "const": false},
        "privateMemoryIncluded": {"type": "boolean", "const": false}
      }
    }
  }
}
